{
    "$schema": "./extensions.schema.json",
    "version": 1,
    "description": "The PHP extensions this server provides, by tier and variant, and where each form of distribution departs from that. The single source of truth for builds, checks and docs.",
    "spc": {
        "version": "2.8.5",
        "note": "Build support per OS is taken from static-php-cli 2.8.5 config/ext.json; our own verified exceptions are added on top."
    },
    "php": {
        "versions": [
            "8.2",
            "8.3",
            "8.4",
            "8.5"
        ],
        "default": "8.3",
        "minimum": "8.1",
        "notes": {
            "8.4": "imap, oci8 and pdo_oci are no longer bundled with PHP; they build from PECL.",
            "8.5": "opcache is always compiled in and cannot be left out."
        }
    },
    "core": [
        "Core",
        "date",
        "hash",
        "json",
        "pcre",
        "random",
        "Reflection",
        "SPL",
        "standard"
    ],
    "tiers": {
        "server": "What the server itself needs to run and isolate requests.",
        "required": "What the standard application platform needs to run.",
        "recommended": "Default extensions, every statically linkable database driver, and caching.",
        "extra": "Everything else static-php-cli can build on the platform.",
        "other": "Known, but not built into any variant (development tools, conflicting runtimes, run-time drivers); ext:build --with adds them."
    },
    "variants": {
        "mini": {
            "tiers": [
                "server"
            ],
            "description": "Only what the server itself needs: the smallest binary."
        },
        "lite": {
            "tiers": [
                "server",
                "required"
            ],
            "description": "The server plus everything the standard application platform requires."
        },
        "standard": {
            "tiers": [
                "server",
                "required",
                "recommended"
            ],
            "description": "lite plus the recommended tier: all static database drivers, caching and full image support. The default."
        },
        "full": {
            "tiers": [
                "server",
                "required",
                "recommended",
                "extra"
            ],
            "description": "Everything static-php-cli can build on the platform."
        },
        "source": {
            "tiers": [
                "server",
                "required",
                "recommended",
                "extra"
            ],
            "kit": true,
            "description": "A build kit, not a binary: the phar, this manifest, the console tool and the static-php-cli recipe, to build any variant locally with qbixctl ext:build."
        }
    },
    "withLibs": {
        "gd": [
            "libjpeg",
            "libpng",
            "libwebp",
            "freetype"
        ]
    },
    "defaultVariant": "standard",
    "platforms": {
        "linux-x86_64": {
            "os": "Linux",
            "arch": "x86_64",
            "label": "Linux x86-64 (static, musl)"
        },
        "linux-aarch64": {
            "os": "Linux",
            "arch": "aarch64",
            "label": "Linux ARM64 (static, musl)"
        },
        "macos-arm64": {
            "os": "Darwin",
            "arch": "arm64",
            "label": "macOS Apple silicon"
        },
        "windows-x64": {
            "os": "Windows",
            "arch": "x64",
            "label": "Windows x64"
        }
    },
    "extensions": {
        "amqp": {
            "tier": "extra",
            "purpose": "RabbitMQ / AMQP messaging",
            "source": "spc",
            "type": "pecl",
            "spc": "amqp",
            "libs": [
                "librabbitmq"
            ]
        },
        "apcu": {
            "tier": "recommended",
            "purpose": "In-memory user cache for cache handlers",
            "source": "owner",
            "type": "pecl",
            "spc": "apcu",
            "packages": {
                "pkg": "php{vv}-pecl-APCu"
            }
        },
        "ast": {
            "tier": "extra",
            "purpose": "PHP abstract syntax trees (static analysis)",
            "source": "spc",
            "type": "pecl",
            "spc": "ast"
        },
        "bcmath": {
            "tier": "recommended",
            "purpose": "Arbitrary-precision arithmetic for prices and authentication maths",
            "source": "code",
            "type": "bundled",
            "spc": "bcmath"
        },
        "brotli": {
            "tier": "extra",
            "purpose": "Brotli compression",
            "source": "spc",
            "type": "pecl",
            "spc": "brotli",
            "libs": [
                "brotli"
            ]
        },
        "bz2": {
            "tier": "recommended",
            "purpose": "bzip2 archives",
            "source": "code",
            "type": "bundled",
            "spc": "bz2",
            "libs": [
                "bzip2"
            ]
        },
        "calendar": {
            "tier": "recommended",
            "purpose": "Calendar conversions used by date helpers",
            "source": "platform",
            "type": "bundled",
            "spc": "calendar",
            "packages": {
                "apt": "php{v}-common",
                "dnf": "php-common",
                "dnf-scl": "php{vv}-php-common"
            }
        },
        "com_dotnet": {
            "tier": "extra",
            "purpose": "COM and .NET interop (Windows only)",
            "source": "spc",
            "type": "bundled",
            "spc": "com_dotnet",
            "unavailable": {
                "linux-x86_64": "Not available on Linux (static-php-cli: no)",
                "linux-aarch64": "Not available on Linux (static-php-cli: no)",
                "macos-arm64": "Not available on Darwin (static-php-cli: no)"
            },
            "unsupportedOs": [
                "Linux",
                "Darwin"
            ]
        },
        "ctype": {
            "tier": "server",
            "purpose": "Character-class checks used when parsing requests and configuration",
            "source": "server",
            "type": "bundled",
            "spc": "ctype",
            "packages": {
                "apt": "php{v}-common",
                "dnf": "php-common",
                "dnf-scl": "php{vv}-php-common"
            }
        },
        "curl": {
            "tier": "required",
            "purpose": "Outgoing HTTP: package downloads, feeds, web services, cache warming",
            "source": "code",
            "type": "bundled",
            "spc": "curl",
            "libs": [
                "curl"
            ],
            "packages": {
                "dnf": "php-common",
                "dnf-scl": "php{vv}-php-common"
            }
        },
        "dba": {
            "tier": "extra",
            "purpose": "Berkeley-style key-value databases",
            "source": "spc",
            "type": "bundled",
            "spc": "dba"
        },
        "decimal": {
            "tier": "extra",
            "purpose": "Arbitrary-precision decimals",
            "source": "spc",
            "type": "pecl",
            "spc": "decimal",
            "libs": [
                "libmpdec"
            ]
        },
        "deepclone": {
            "tier": "extra",
            "purpose": "Fast deep object cloning",
            "source": "spc",
            "type": "pecl",
            "spc": "deepclone"
        },
        "dio": {
            "tier": "extra",
            "purpose": "Direct low-level I/O (serial ports, devices)",
            "source": "spc",
            "type": "pecl",
            "spc": "dio"
        },
        "dom": {
            "tier": "required",
            "purpose": "XML documents: rich text, packages, feeds, WebDAV",
            "source": "code",
            "type": "bundled",
            "spc": "dom",
            "libs": [
                "libxml2",
                "zlib"
            ],
            "packages": {
                "apt": "php{v}-xml",
                "dnf": "php-xml",
                "dnf-scl": "php{vv}-php-xml"
            }
        },
        "ds": {
            "tier": "extra",
            "purpose": "Efficient data structures",
            "source": "spc",
            "type": "pecl",
            "spc": "ds",
            "unavailable": {
                "windows-x64": "static-php-cli 2.8.5 builds it on Windows with a source path that no longer exists (nmake: don't know how to make ext\\ds\\src\\ds\\ds_deque.c)"
            }
        },
        "enchant": {
            "tier": "other",
            "purpose": "Not yet buildable by static-php-cli",
            "source": "spc",
            "type": "bundled",
            "spc": "enchant",
            "unavailable": {
                "linux-x86_64": "static-php-cli does not build it for Linux yet",
                "linux-aarch64": "static-php-cli does not build it for Linux yet",
                "macos-arm64": "static-php-cli does not build it for Darwin yet",
                "windows-x64": "static-php-cli does not build it for Windows yet"
            },
            "notInFull": "Not yet buildable by static-php-cli"
        },
        "ev": {
            "tier": "extra",
            "purpose": "libev event loop: epoll/kqueue for the Revolt event loop backend (see architecture.md)",
            "source": "spc",
            "type": "pecl",
            "spc": "ev"
        },
        "event": {
            "tier": "extra",
            "purpose": "libevent event loop: epoll/kqueue for the Revolt event loop backend (see architecture.md)",
            "source": "spc",
            "type": "pecl",
            "spc": "event",
            "libs": [
                "libevent"
            ],
            "unavailable": {